,href,点赞用户数,评分,参与评分人数,热度,总计评论数,演员,信息,剧情
425,http://www.iqiyi.com/v_19rrn6tv98.html,154,7.3,444人评分,458,全部评论(23),杜德夫;欧阳儒秋;李百万,葡萄熟了的时候;导演： 王家乙;地区： 华语;类型： 喜剧;首映： 1953,简介：1951年，南沙村葡萄大丰收。周大娘园里的十亩葡萄每亩摘到1200斤。为了安装水车和给女儿红娥置办嫁妆，周大娘等不及赶庙会，急着想卖掉葡萄。红娥与合作社主任丁老贵的儿子双喜相爱。大娘找到亲家，请他帮助解决。丁老贵认为合作社只管供应社员生活用品，推销葡萄不是份内事。两人为此产生矛盾，周大娘一气之下要将葡萄卖给奸商刁金。刁金趁机压低收购价格，经支农工人龚玉泉劝阻，周大...收起>
426,http://www.iqiyi.com/v_19rrm8t3hk.html,95,7.2,744人评分,465,全部评论(17),韩非饰 乔溪;陈述饰 蓝心会;李保罗饰 梢公;孙景璐饰 蓝秀英,乔老爷上轿;导演： 刘琼;地区： 华语;类型： 喜剧;首映： 1959,简介：古时候，书生乔溪赴京赶考，巧遇官府小姐蓝秀英，俩人一见钟情。秀英之兄蓝木斯乃一纨绔子弟，整日游手好闲，欺男霸女。他见黄家女儿丽娟生的貌美，伺机抢亲。黄母无奈携女出逃至某客栈，蓝随后带家丁追到客栈，迷路的乔溪则路遇抢亲花轿钻进去，被误为黄女抬入蓝府。一觉醒来的乔溪闻听事由经过，在轿内男扮女装，要戏弄一下飞扬跋扈的蓝公子。秀英非常不满哥哥的抢亲行为，协助乔溪假戏真做。蓝母...收起>
427,http://www.iqiyi.com/v_19rr7pyt60.html,41,7.5,100人评分,463,全部评论(5),叶枫饰 古秀秀;蒋光超饰 姚德宝,山歌恋;导演： 罗臻;地区： 香港地区;类型： 爱情;首映： 1964,简介：牧羊姑娘古秀秀喜唱山歌，青年刘大龙自置帆船，运货于县城与小镇之间。秀秀与大龙时以山歌对唱，情愫互生。曾老虎欲娶秀秀，以追债要胁古老头许婚；大龙冒险运货入城，冀替古老头还债。怎料大龙竟然失踪，古老头既无钱还债，秀秀亦以为大龙已死，无奈答允下嫁曾老虎……收起>
428,http://www.iqiyi.com/v_19rr7pzbh0.html,101,6.5,155人评分,493,全部评论(7),林黛饰 貂蝉;赵雷饰 吕布,貂蝉;导演： 李翰祥;地区： 香港地区;类型： 爱情;首映： 1958,简介：本片改编自《三国演义》之「连环计」，由四届亚洲影后林黛饰演貂蝉。剧情讲述汉朝末年，太师董卓专权祸国，诸侯群起声讨。忠臣王允利用貂蝉的美色，离间董卓和其义子吕布，终使父子反目，吕布杀了董卓，并和貂蝉成为眷属。收起>
429,http://www.iqiyi.com/v_19rrn6rkgg.html,74,7.3,692人评分,392,全部评论(11),王尚信;张雁;王熙岩,燎原;导演： 顾而已 / 张骏祥;地区： 华语;类型： 动作;首映： 1962,简介：二十世纪初，江西某煤矿。煤矿工人整天受矿主的压榨奴役，却连温饱都顾不上。共产党成立后，雷焕觉被派到矿上，利用办夜校的方式秘密组织工人，以期提高他们反压迫、反剥削的思想觉悟。收起>
430,http://www.iqiyi.com/v_19rrnz77zo.html,180,7.2,598人评分,478,全部评论(20),龚雪;郭凯敏;高博,好事多磨;导演： 宋崇 / 张惠钧;地区： 华语;类型： 爱情;首映： 1980,简介：1979年，海军某部。老首长刘政委大龄女儿刘方方的婚事引起了魏侠的关注，她查阅人事档案从中筛选，最后挑中了某研究所的沈治远。她采用“拉郎配”的方法带沈治远到南港和方方相亲，这让沈非常不解和反感。插队时方方和赵寅武曾谈过恋爱，赵的妻子纪鸿是个心胸狭窄的女人，非常妒恨方方，在沈刘结婚之日，她竟送去一只王八，另沈感到羞辱。婚后第二天，沈就冷落了方方回单位去了，方方为了不剌激患心...收起>
431,http://www.iqiyi.com/v_19rr7qbg1c.html,107,7.5,41人评分,643,全部评论(3),未知主演,寇准背靴;导演： 郭筠;地区： 华语;首映： 1961,简介：本片记录了88岁高龄的淮北梆子著名老艺人顾锡轩演出的《寇准背靴》。北宋时期，昏王无道，听信谗言，陷害忠良，将忠心报国的杨延景元帅充军云南。而后奸臣王钦若陷害杨延昭，假传圣旨赐其毒药。杨延景狱中好友任堂辉不忍忠良遭害，喝下毒药才使得杨延昭逃过一死。后来，杨府虚报杨延昭病死，假设灵堂，想自此回河东隐居。此时，辽军进犯，边疆告急。八贤王和天官寇准听到杨延景的噩耗，心情十分沉...收起>
432,http://www.iqiyi.com/v_19ruewc108.html,253,0,0,603,全部评论(45),张乐平,三毛流浪记（1958）;导演： 章超群;地区： 华语;类型： 动画;首映： 1958,简介：三毛是旧社会的苦孩子，他无依无靠，受尽了折磨，但它又是一个善良的、勇敢的好孩子，他的遭遇就是旧社会千千万万少年儿童的遭遇。枯瘦如柴的三毛行走在灯火通明、笑语欢歌的大都会上海。狂风暴雨的大街小巷，到处可见外国产品的宣传广告，这里的繁荣与三毛没有一点关系。广告中胖娃娃吃的进口奶粉，他只能用那奶粉罐子当要饭的家伙。大雨之夜，三毛连暂时避雨的栖身之所都找不到，粗暴的警察和骄傲...收起>
433,http://www.iqiyi.com/v_19rrddm39w.html,100,6.5,852人评分,1947,全部评论(46),朱颜曼滋饰 宫蓓蓓;田雨饰 宫父;邱雨铄饰 杨泽,早安公主;导演： 吕柯憬;地区： 华语;类型： 青春;首映： 2019,简介：一个残疾少女勇敢追寻梦想的故事。就读于某艺术类高中二年级的少女宫蓓蓓，在同学眼中是一个性格内向、少言寡语、独来独往的异类。由于早年母亲车祸去世，加上自己身体上的缺陷，自卑的蓓蓓早早就品尝到孤独的苦涩。直到有一天她发生了一起撞车事故，青春的蓝色大门渐渐打开，那束光从此照进生命……收起>
434,http://www.iqiyi.com/v_19rr7rhjh8.html,90,7.4,456人评分,554,全部评论(7),尔冬升饰 康熙;王祖贤饰 纳兰琼瑶,天官赐福（粤语）;导演： 鲁俊谷;地区： 华语;类型： 喜剧;首映： 1985,简介：　故事描述康熙少年嗣位，太后急欲替其完婚，遂选纳大臣之女纳兰琼瑶为妃，但琼瑶为争取婚姻自由离家出走，康熙亦乐得不用成婚。後康熙不耐宫中生活刻板，决定微服下江南游玩，却偶见女扮男装的琼瑶；二人结伴同游，分享在民间遇见的种种趣事…收起>
435,http://www.iqiyi.com/v_19ruy3d0us.html,62,6.3,379人评分,500,全部评论(22),姜姿姿饰 刘依依;王腾飞饰 刘宝,花开荼蘼;导演： 王腾飞;地区： 华语;类型： 家庭;首映： 2019,简介：一个天真善良、叛逆倔强的女孩刘依依，在外打工感情受挫，回到家里想过安稳的日子。懵懂的少女通过媒人介绍嫁给了一个常年在外的男人。两人长期分居，没能如期给婆家延续香火，刘依依被逼着外出跟丈夫一起工作，拒绝后被贴上了不孝儿媳的标签。丈夫的不理解，父亲的去世，婆家的逼迫，自己辛苦挣钱的工作被误认为是偷情换来的，当时间证明了她内心的善良，可年轻的心再也回不来了……收起>
436,http://www.iqiyi.com/v_19rr4l3vk4.html,161,6.3,1557人评分,571,全部评论(117),周子扬饰 周浩;杨子逸（演员）;黄君君,再爱的机会;导演： 杨睿;地区： 华语;类型： 爱情;首映： 2018,简介：刚刚离婚后的苏晓，搬出周浩的家，和女儿搬到一个老式的出租屋，迫于生活的压力，小豌豆妈妈必须打两份工，受尽这种两边的折磨后，周浩决定离开苏晓，不想再这样生活下去了，周浩认为苏晓理解不了他对孩子的那份心。房间空荡荡的留下苏晓一个人，苏晓哭泣着，回忆着过去和周浩那些甜蜜，心里备受着折磨。数月过后，正在忙着整理文件的周浩，接到医院的电话，才知道苏晓一直是患有绝症的，在生命的...收起>
437,http://www.iqiyi.com/v_19rrf7uuak.html,73,7.3,263人评分,379,全部评论(12),Amira Casar主演,1000小时的夜晚;导演： 维吉尔·维德里希;地区： 其它;类型： 悬疑;首映： 2017,简介：故事聚焦在世代经营家族企业的乌利希大家族，原本打算卖掉持股的老太太在签字时突然暴毙。当大家手忙脚乱，为合约是否有效而争执不休，打电话报警时，她又复活过来了！就在今夜，不只有她，列祖列宗全都重返人间，阴阳两界三代同堂，以为灰飞烟灭的往事再度在大宅中上演。让众人疑惑的是，二战期间过世的爷爷始终没有上演复活秀，菲利普怀疑爷爷当年的死没有那么单纯，决心要揪出杀死爷爷的凶手，但...收起>
438,http://www.iqiyi.com/v_19rrlme8o0.html,292,6.8,944人评分,564,全部评论(136),孙木子易;李昱晓,换种方式;导演： 张穆;类型： 爱情;首映： 2016,简介：从上海回来寻根的彝族女孩周若男在关注一个微信公众号后置身来到红土地，与公众号编辑、从北京来红土地定居的画家陆海清巧遇，认识一直陪在陆海清身边的当地彝族女孩阿莎依，三人在这片绚烂的红土地上展开了一系列幽默、动人的故事！该片不仅以红土地为拍摄背景，同时选取了两区的其他著名景点为拍摄地，其中轿子雪山、转龙蒋家大院、彝族村落乐尼白等等，这些都给影片增加了更为神秘的色彩！收起>
439,http://www.iqiyi.com/v_19rw3tdpww.html,435,7.2,6123人评分,3139,全部评论(705),韩明熙饰 李白,少年李白：花月离;导演： 桂言;地区： 华语;类型： 悬疑;首映： 2020,简介：神秘花妖惑乱皇宫，惊扰圣上，引出一个少年李白仗剑追凶的故事。潇洒俊逸的少年李白，空有才华却郁郁不得志，诗剑双绝，却只能混迹酒楼。机缘巧合，李白奉命追查花妖一案，与皇后身边的侍酒宫女月离一同游走长安，搜寻花妖踪迹。随着调查深入，李白屡屡发挥推理能力，从困境中找出线索，又凭借非凡剑法化险为夷。他身边的的怪咖术士庄丹生、妖艳舞女胡姬等江湖人物，纷纷被卷入花妖事件当中。李白不...收起>
440,http://www.iqiyi.com/v_19rrhob8w8.html,828,6.8,578人评分,501,全部评论(7),艾米莉·布朗特饰 Iris;罗丝玛丽·德薇特饰 Hannah;马克·杜普拉斯饰 Jack;Mike Birbiglia饰 Al;Mel Eslyn饰 Photography Studio Crew,姐妹情深;导演： Lynn Shelton;地区： 美国;类型： 爱情;首映： 2012,"简介：Jack因为弟弟Tom的去世已经消沉很长一段时间了，他的好朋友，也是Tom的前女友Iris劝他骑着单车到她父亲在一座小岛上的屋子里去思考人生。来到屋子的Jack却意外发现了Iris的姐姐Hanna也在。两人喝了酒，相谈甚欢,情不自禁地发生了关系。第二天，因为工作调整而放假的Iris也来到了这屋子里。三个各怀心事的人将上演怎样一出喜剧？收起>"
441,http://www.iqiyi.com/v_19rvgjeph8.html,70,6.6,421人评分,476,全部评论(6),赵晟魁饰 牛福生;蔡聪洁饰 春燕,公主裙;导演： 赵淑彬;地区： 华语;类型： 青春;首映： 2019,简介：外婆的突然离世，让从小跟着外婆长大的茉茉没能见到外婆最后一面，因此而遗憾难过。而此时，父母承包的养鸭场又遭遇禽流感的危机，家庭陷入了穷困之中。她听说穿上“公主裙”就能再次见到外婆，为了弥补心中的遗憾，得到梦寐以求的“公主裙”，多次向父母提出想买一件“公主裙”。而此时，家庭的重担给父母带来的前所未有的压力。妈妈不仅没有给她买，反而批评了她们。于是，她们想利用暑假在鸭场帮...收起>
442,http://www.iqiyi.com/v_19rrny8n90.html,162,5.3,641人评分,776,全部评论(3),何麟;沈敏;金莉莉,禁烟枪手;导演： 达式彪;地区： 华语;类型： 枪战;首映： 1990,简介：民国年间，鸦片泛滥上海滩。深夜，禁烟枪手林哲明见到昔日恋人秦娅，此时，黑帮宋继良差人邀林去为他刺杀仇家，不知是计的林哲明遭宋暗算受伤，秦娅被人掳走，林哲明侥幸躲到温可君家，温有意帮林营救秦娅。经查，鸦片作坊主管是赵金根，林化装成广州巨商与赵周旋，得知真正的毒枭是方树信。不料，秦娅突然出现，她把枪对准林哲明，并声言自己是毒王的人。僵持中，秦娅使用苦肉计，调转枪囗打死方树...收起>
443,http://www.iqiyi.com/v_19rrnybz9w.html,71,6.6,511人评分,542,全部评论(5),张莹;张平饰 石得富;杜德夫饰 石永公,沙家店粮站;导演： 干学伟;地区： 华语;类型： 枪战;首映： 1954,简介：1947年春天，蒋介石匪帮调动了数十万兵力疯狂地进犯陕甘宁边区。当时，边区的军民在毛主席和党中央的领导下，主动撤出延安，屡次给疯狂的敌人以沉重的打击。7月间，我军为了诱敌北进，猛扑榆林城。这时保证数万野战军的粮食供应，便成为陕北人民争取胜利的主要任务。沙家店是米脂县的一个区，那里设立了粮站。到那里领粮的部队很多，粮站的粮食眼看供应不上了。曹区长、区委金书记为了克服这个困难...收起>
444,http://www.iqiyi.com/v_19rro2o82o.html,179,5.6,376人评分,479,全部评论(13),韩少云;徐菊敏;菊桂芳;张忠义,小姑贤（评剧）;导演： 林农;地区： 华语;类型： 爱情;首映： 1953,简介：姚氏25岁就死了丈夫，她含辛茹苦地将一儿一女抚养成人。女儿英英生来聪明伶俐，儿子继孟十分孝顺。继孟娶妻后夫妇感情很好，而带有封建思想的姚氏对此很不欢喜。姚氏非常偏心爱女儿就像掌上明珠，对媳妇却视为眼中钉，常常无事生非地打骂媳妇。一天，媳妇给婆婆端上早饭，婆婆挑剔地说她做的饭缺盐少酱不对胃口，并故意为难媳妇，要媳妇马上做出86样饭来给她挑选。媳妇实在没有办法做出，姚氏借口说...收起>
445,http://www.iqiyi.com/v_19rv3xvmwk.html,55,6.5,641人评分,417,全部评论(7),韩瑜（童星）饰 土娃,红崖村的孩子们;导演： 韩凤泉;地区： 华语;首映： 2019,简介：村小唯一的老师参加了抗日游击队，秋阳姐将村里的孩子们组织起来成立的儿童团。勇敢的儿童团员们不仅冒险掩护了受伤的八路军侦察员，还巧妙地躲过了日伪军的盘查，将500支红缨枪头运送到了牙山。孩子们用自己的方式表达了拳拳报国之心。收起>
446,http://www.iqiyi.com/v_19rrn5w3ck.html,84,6.8,313人评分,346,全部评论(2),易东林饰 万马书记;毕福生饰 然洛;张慕芹饰 秀什吉,草原风暴;导演： 林丰;地区： 华语;类型： 枪战;首映： 1960,简介：1958年的早春，青海黄仁藏族地区的牧民们在党的领导下，走上了合作化的道路。反动活佛拉莫茸和大干户多尔吉预感到草原上的合作化运动已经从根本上动摇了他们奴隶主统治的基础。因此，他们藏匿了一个解放时漏网的蒋匪少校军官马乙奴，企图搞垮牧业社，进一步发动反革命叛乱。他们利用宗教和迷信拉拢群众，迫使牧民们怀疑并远离牧业社。拉莫茸指使小喇嘛旦增在牧业社修建定居点的工地上偷偷地埋上一块...收起>
447,http://www.iqiyi.com/v_19rrn4kkyg.html,557,6.3,880人评分,474,全部评论(73),露西·沃克,海啸与樱花;导演： 露西·沃克;地区： 美国;首映： 2011,简介：2011年日本3月11日地震海啸灾后纪录短片，深刻记录了灾后日本的样貌和人们惶惶不可终日的心情，同时也记录了灾后大家齐心协力重建的毅力和信心！本片的导演是露西·沃克是去年奥斯卡提名纪录长片《垃圾场》的导演之一，而且本片也获得了2012奥斯卡最佳纪录短片！收起>
448,http://www.iqiyi.com/v_19rrny90ag.html,249,6.9,1385人评分,341,全部评论(46),夏天饰 朱自治;王诗槐饰 高小庭;汪正煜饰 金经理;徐少根;卢青饰 包坤年,美食家;导演： 徐昌霖;地区： 华语;类型： 喜剧;首映： 1985,简介：十一届三中全会之后，苏州城松鹤楼饭店经理高小庭意欲恢复由他在文革期间一手破坏了的苏州传统名菜，但苦于授艺法人，便发动群众献计献策、推荐能人。这时，一个人进入了高小庭的视野——朱自治。此人是一个有名的怪人，嗜吃如命，不过却得了一个“美食家”的称呼。朱自治也正打算着要筹建烹饪协会，为了争得烹饪协会主席的头衔，特意让妻子孔碧霞准备了一桌丰盛的佳肴。邀请包括高小庭在内的行业内...收起>
449,http://www.iqiyi.com/v_19rvjoja90.html,148,7.0,444人评分,802,全部评论(11),胡锦饰 八姑;井莉饰 阿香,七十二家房客（粤语）;导演： 楚原;地区： 香港地区;类型： 喜剧;首映： 1973,简介：　故事围绕着一幢破旧的旧式大院展开，着力描画了租住在此的七十二家房客的众生相。众房客在包租婆八姑的欺压下，终日不得安生。八姑风骚刁泼，待人刻薄。而她的养女阿香却乐于助人。终于，八姑的苛刻规定“房客每天只能用两桶水”成为了导火索，做洗熨的上海婆带头抗议，得到房客们的合力支持。加上发仔、阿福等人的附和，一段段斗智斗勇的小故事连番上演，由香港邵氏兄弟有限公司拍摄的电影《七十...收起>
450,http://www.iqiyi.com/v_19rr7qcn0c.html,40,7.3,391人评分,365,全部评论(2),尔冬升饰 丁鹏;汪明荃饰 青青;王戎饰 柳若松,圆月弯刀（粤语）;导演： 楚原;地区： 华语;类型： 动作;首映： 1979,简介：青年丁鹏出身低微，习得祖传“天外流星”剑法后挑战各路武林高手，欲扬名立万以光宗耀祖，不料武当掌门柳若松令妻子可笑施计陷害，使丁鹏失却剑谱，名誉扫地。丁鹏万念俱灰寻至荒郊了却残生，却被自称“狐鬼”的女子青青拦下，二人自此在世外桃源般的人鬼边界习练武功，并结为伉俪。一年后，丁鹏掌握了圆月弯刀刀法已天下无敌，不顾青青阻拦执意出山复仇。二人以其人之道还治其人之身让柳若松身败名...收起>
451,http://www.iqiyi.com/v_19rr7q28zw.html,180,7.5,511人评分,493,全部评论(11),诺拉·琼斯饰 Elizabeth;裘德·洛饰 Jeremy;娜塔莉·波特曼饰 Leslie,蓝莓之夜;导演： 王家卫;地区： 美国;类型： 爱情;首映： 2007,简介：伊丽莎白被男友抛弃，伤心又苦恼的她把钥匙扔在咖啡店里。咖啡店的老板杰瑞米保存了很多钥匙，每把钥匙都埋藏了一个伤心的故事。伊丽莎白爱吃店里没人点的蓝莓蛋糕，在某一晚决定离开纽约，穿越美国到处看看。在旅途上认识了明明深爱却困囿彼此的分居夫妇，还有豪爽爱赌却鲜回家看望父亲的少女，每到一个地方她就给杰瑞米写一张明信片。以他人为镜，伊丽莎白找到了爱的真谛，回到纽约，看见等待自己...收起>
452,http://www.iqiyi.com/v_19rsbxnk4w.html,48,6.8,87人评分,473,全部评论(1),傅声;狄龙;钱小豪,广东十虎与后五虎（粤语）;导演： 张彻;地区： 香港地区;类型： 动作;首映： 1979,简介：故事描述，广东十虎之一谭敏之侄谭聪，在赌馆当巡场；一夜，十虎的徒弟及后人等四人，在赌场相聚时，旗人佟七带着前清官之子梁小虎突袭，把谭聪杀死。原由是十虎之黎仁昭、谭敏等，昔日曾把梁父杀死，以助反清义士蔡民义脱险。梁小虎遂决意与师叔佟七、佟八连手，杀死仍在世的十虎及其后人、传人，为父报仇……收起>
453,http://www.iqiyi.com/v_19rwhsmado.html,20,7.2,45人评分,358,全部评论(0),白茵;傅奇;江汉,西施（1965）;导演： 李晨风;地区： 华语;类型： 爱情;首映： 1965,简介：春秋战国时代，大夫范蠡与烷纱女西施相爱，共定鸳盟。吴兵入侵，会稽沦陷，西施双亲被害；越国仅余5000残兵，危在旦夕。越王率王后及范蠡、文种等投降吴国，卧薪尝胆，以图复兴；西施也被吴王强虏为妃。伍子胥为免除后患，进谏吴王杀害越王。西施出言相救，并说服吴王释放越王。吴攻齐，越兵乘机攻吴。吴王将西施杀死，范蠡刺死吴王，为西施报仇。收起>
454,http://www.iqiyi.com/v_19rrh619bo.html,372,6.6,556人评分,659,全部评论(17),赵丹饰 Little Broadcast;吴茵饰 ..Mrs. Xiao (as Yin Wu);上官云珠饰 .Mrs. Hua,乌鸦与麻雀;导演： 郑君里;地区： 华语;类型： 家庭;首映： 1949,简介：影片故事发生在1948年冬天上海的一幢弄堂房子里。小官僚侯义伯非法霸占了这所房子，把原房主孔有文赶到咫尺之地的后客堂，他自己和姘妇余小瑛住在二楼。政府摇摇欲坠，侯义伯急于把房子顶出去好捞几个钱逃命。这件事引起房客们的恐慌，大家忙想办法对付。但与世无争的孔有文不敢挺身收回房子，华先生也自视清高不肯领头，肖老板自愿出头却碰了钉子。大家只好各自为谋。肖太太把仅有的首饰和盘尼西林...收起>
455,http://www.iqiyi.com/v_19ruv0gvsk.html,86,8.4,124人评分,786,全部评论(9),王丹凤;冯喆;韩涛;周文彬,桃花扇（独家修复版）;导演： 孙敬;地区： 华语;类型： 爱情;首映： 1963,简介：电影《桃花扇》根据欧阳予倩先生的剧本《桃花扇》拍摄的。他以清代孔尚任的传奇剧本《桃花扇》为蓝本，改编成京剧《桃花扇》，借古喻今，流露了强烈的民族意识和爱国主义思想。一九四七年，他又将京剧《桃花扇》改编成话剧，突出了正义与邪恶，爱国主义与卖国主义的思想斗争，塑造了一位富有反抗性格，具有坚贞爱国情操的风尘女子李香君的形象。而孔尚任的《桃花扇》是借李香君和侯朝宗的离合之情...收起>
456,http://www.iqiyi.com/v_19rr1kw9vg.html,622,6.9,2600人评分,359,全部评论(164),刘安琪（演员）饰 江小艾,中二少女;导演： 张飞鸿;地区： 华语;类型： 喜剧;首映： 2018,简介：童年的江小艾在一场车祸中目睹了母亲的去世从而在心中蒙上了一层阴影。小艾的爸爸为了让女儿走出阴影想方设法给她编织了一个魔法故事，小艾在这个魔法故事中逐渐长大，确实走出了童年的阴影，但是又变成了一个深度中二病患者…收起>
457,http://www.iqiyi.com/v_19rr8r41rc.html,94,5.2,523人评分,662,全部评论(22),阿宗饰 卫长明;段冉饰 冷血,刺客冷血;导演： 冯烽;地区： 华语;类型： 爱情;首映： 2017,简介：故事讲述的是明末年间的俗家弟子卫长明，奉师命护送佛身舍利前往皇家寺庙。谁知路上遇到杀手冷血。一番争斗中意外穿越时空，来到现代，遇到小艾。在小艾的帮助下顺利拿到了丢失的舍利同时又被冷血盯上，小艾为救自己的妹妹，被冷血所杀。卫长明看着死在怀里的小艾悲痛万分，决心要为小艾报仇。在张芃的帮助下，卫长明得以手刃冷血，为小艾报仇。收起>
458,http://www.iqiyi.com/v_19rqzcs07k.html,188,7.0,3076人评分,368,全部评论(26),马健君饰 魏春树;卢诗雨饰 江暮云,疯狂的公寓;导演： 王辉;地区： 华语;类型： 喜剧;首映： 2018,简介：魏春树是一家房地产公司的小职员，毕业以后他就留在了这座旅游城市，在这座城市租了房，他的收入并不很高。所以虽然他一直心仪公司前台江暮云，但他始终没有勇气去追求。为了晋升，他把自己租的房子借给顶头上司幽会情人，终于有一天他得到了总经理的召见，原来总经理也想要他房的钥匙，魏春树赶忙交出钥匙。魏春树终于升了职。想追求江暮云，但原来和江暮云约会的人就是总经理。魏春树起先被蒙在鼓...收起>
459,http://www.iqiyi.com/v_19rt4hmh6o.html,21.7万,6.7,823人评分,378,全部评论(272),向波饰 魏莱;伍姣饰 倪好;王琪权饰 杨山,绽放青春;导演： 姚酷;地区： 华语;类型： 青春;首映： 2019,简介：故事讲述魏莱在创业中屡受挫折，事业失败，与之谈了六年恋爱的女朋友蒋月也离之而去；欠下的信用贷款，让魏莱倍受刺激，成天以酗酒消愁，麻醉自己，好友杨山不想让其陷入太深，便给与鼓励与安慰，不料弄巧成拙，两人反目成仇，杨山的多次劝阻，使魏莱振作起来，从头开始，兼职的跑车中与倪好结下不解之缘，误会与矛盾让彼此加深感情，女朋友的离开，父亲的重病，银行的催账，狠狠地刺激了魏莱，无颜...收起>
460,http://www.iqiyi.com/v_19ruuh23mc.html,46,6.7,347人评分,1016,全部评论(15),沈文俊饰 高奇;覃文静饰 江怡,指尖世界;导演： 于武舟;地区： 华语;首映： 2019,简介：讲述主人公如何用一根手指在15年间敲出300多万字文学作品生命奇迹的电影。
