,href,点赞用户数,评分,参与评分人数,热度,总计评论数,演员,信息,剧情
0,http://www.iqiyi.com/v_19rrhoipqg.html,2.0万,8.8,27.8万人评分,4021,全部评论(2135),张赫;秀爱;朴孝珠;车仁表;李相烨,流感;导演： 金成洙;地区： 韩国;类型： 惊悚;首映： 2013,简介：一群东南亚偷渡客历经艰险来到韩国，但是整个集装箱内的偷渡客几乎全部死亡，只有一人拖着羸弱的身体侥幸逃入闹市之中。殊不知此人身上携带致命猪流感病毒，短短一天时间，病毒迅速蔓延城市的各个角落。许多人在不知不觉间被感染，进而将死亡的阴影引向周围所有的人。美丽的女医生金仁海是一位单身妈妈，她不久前遭遇一场车祸，幸被消防队救援人员姜智久救出，却因丢失重要论文资料而备受上司苛责。...收起>
1,http://www.iqiyi.com/v_19rr7p31qg.html,2.0万,8.1,29.5万人评分,4562,全部评论(1127),巩俐饰 菊豆,菊豆;导演： 张艺谋;地区： 华语;类型： 家庭;首映： 1990,简介：杨天青的叔叔杨金山，是个有生理缺陷的染坊主，在折磨死两房太太后，为续香火，他又花大价钱买了个年轻漂亮的女人菊豆，对其百般虐待。年近四十而尚未娶亲的天青，对因叔叔每夜滥施淫威而痛苦哀叫的菊豆由怜生爱，两人私通，生得一子。金山喜出望外，以为己出，取名天白。但不久金山中风，半身不遂，菊豆与天青更加肆无忌惮，得知真相的金山想要报复，后却误坠染池丧命。按家族的规矩，天青要搬出染...收起>
2,http://www.iqiyi.com/v_19rrj52998.html,3828,9.0,52.8万人评分,2596,全部评论(2657),周星驰饰 Leon;莫文蔚饰 群,回魂夜;导演： 刘镇伟;地区： 香港地区;类型： 惊悚;首映： 1995,简介：一场阴差阳错的谋杀案，牵连了一栋大厦里多个无辜的人。失恋女在七月半被男友抛弃，于是把自己关在房里，不断往楼下扔东西发泄。两个心怀鬼胎的保安也在此时酝酿打劫大厦的计划。一对夫妇突然间不见了儿子，遂请求保安队长帮忙。队长进入二人家中却发现了另一桩与死去老妇有关的凶案。而此时失恋女发现了站在楼道口对着一盆花说话的神秘黑衣人。队长发现了夫妇谋杀老母亲的事实，遂被追杀。而此时...收起>
3,http://www.iqiyi.com/v_19rrg0bus0.html,2.7万,8.8,211.4万人评分,2434,全部评论(1.1万),陈思诚饰 妇科医生章开;包贝尔饰 傻弟弟,一路顺疯;导演： 叶伟民;地区： 华语;类型： 喜剧;首映： 2013,简介：医术精湛的妇产科医生章开风流倜傥，颇有“女人缘”，对男女之事素来抱着“只求开心，不求结果”的不负责心态，是典型的一名“高富帅渣男”。某天一封携带B超化验单的神秘邮件，让在花丛中来去自如的章医生从此“一蹶不振”。为了能让自己“重振雄风”，章开决定要找到这个女人和自己的孩子，而一心寻找初恋情人的弟弟更成了他一路上无法甩开的麻烦制造源，这趟注定波折不断的旅程将奔向怎样的终点...收起>
4,http://www.iqiyi.com/v_19rw1u18xg.html,1.3万,6.2,10.6万人评分,4809,全部评论(1418),陈虎饰 巍然;郭晓峰饰 王参谋;郑沛琳饰 沈清;史洪波饰 慧强;吴潇娜饰 玛雅,特种兵王3之战天娇;导演： 李成龙;地区： 华语;类型： 枪战;首映： 2020,简介：影片主要讲述了安保人员李健被某国际贩毒组织以为是扫毒人员而准备将其杀害，安保组织得知消息后派沈清成立安保青峰小组，解救李健，经过周密计划，沈清打入毒贩内部，与当地警方里应外合，最终剿灭毒贩集团，成功解救李健。收起>
5,http://www.iqiyi.com/v_19rvxgce5s.html,2.2万,7.9,36.6万人评分,4602,全部评论(7831),于震饰 宋慈;潘长江饰 知县;许梦圆饰 雨墨,法医宋慈;导演： 胡国瀚;地区： 华语;类型： 犯罪;首映： 2020,简介：影片讲述了一夜之间二十七具尸体被悬挂当街，且都被抽去了骨头，死相诡谲。向来不信邪的宋慈以一种追求极致真相的态度与女助手雨墨深入调查。通过对死者关系网的盘查，宋慈发现这与十年前的波旬教案有关，他向恩师耿知年请教，谁知当天二十七具尸体就在府衙中自燃，虽灰飞烟灭却有迹可寻，宋慈不得不怀疑这一切正和当年负责波旬教案的耿知年有关。然而，就当宋慈觉得无限接近真相时，一个线索的出现...收起>
6,http://www.iqiyi.com/v_19rwftc3j8.html,2.3万,7.3,48.6万人评分,3647,全部评论(3156),彭禺厶饰 李纯洪;潘霜霜饰 青嫣,九指神丐;导演： 秦向飞;地区： 华语;类型： 奇幻;首映： 2020,简介：故事发生在南宋、金、西夏并立的乱世，身为西夏七皇子的李纯洪（洪七公）因为被一位世外高人预言将会成为兼济天下、继承大统的最佳人选，因而被父皇李仁孝派到南宋学习汉民族文化，但是却遭到大哥李纯霸暗中派人刺杀，李纯洪死里逃生，被逍遥派掌门虚竹和其弟子青嫣所救，但因负伤失去记忆，只记得乳名洪七，后来在经历与青嫣相爱被逐出师门，寻找青嫣身入丐帮、与青嫣重逢成为南宋驸马，恢复记忆后...收起>
7,http://www.iqiyi.com/v_19ruzyr10c.html,2.7万,8.2,64.8万人评分,4996,全部评论(4921),白百何饰 白树瑾;张子枫饰 小女孩;魏大勋饰 仲要;许娣饰 白母;李建义饰 白父,亲爱的新年好;导演： 彭宥纶;地区： 华语;类型： 爱情;首映： 2019,简介：离乡打拼的白树瑾早年间为了有个更好的生活，放弃了向往的图书行业，转行成为地产经纪，不想工作成果惨淡，职场遭遇劲敌。到北京的第十个年头，白树瑾屡遭挫折，面临事业停滞、情路不顺、房租暴涨、母亲病情加重等多重打击，此时初到大城市打工的合租室友女孩、突然闯入她的生活，在这个女孩的身上白树瑾似乎找到了十年前的自我，同时她也遇见了小七岁的同事仲要，渐渐地她开始有了变化……收起>
8,http://www.iqiyi.com/v_19rw1cqdm4.html,1.1万,7.8,2.9万人评分,2918,全部评论(1048),王宁饰 叶开;叶逢春饰 吴为;梁家仁饰 李老大;袁祥仁饰 故事老人;马朋饰 傻子,雾隐怪客;导演： 张敬松;地区： 华语;类型： 奇幻;首映： 2020,简介：因为尘封在一所民居下的哥窑遗址，高学历盗墓贼叶开，改头换面潜入农民吴为家，贪吃蛇遇上善良农夫，上演了一场好玩的夺宝故事。从活人家里偷东西，谋财必然离不开害命，盗此一游，金钱VS良知，杀人还是救人，叶开面临着人性的考验。收起>
9,http://www.iqiyi.com/v_19rv62nbf8.html,5.3万,8.6,129.1万人评分,4175,全部评论(8214),任素汐饰 莫默;吴昱翰饰 孙同;刘迅饰 郑多多;汤敏饰 高璐,半个喜剧;导演： 周申 / 刘露;类型： 喜剧;首映： 2019,简介：三个自由浪漫的年轻人，过着各怀心思的人生：有人急着摆脱单身，有人想在结婚前放荡一番，有人想在大城市站稳脚跟。因为一次情感出轨，三人扭结成了一团“嬉笑怒骂”的乱麻。当各种价值观碰撞在一起，当一个人需要平衡亲情友情与爱情......他们慌乱的生活，就像是半个喜剧。收起>
10,http://www.iqiyi.com/v_19rra5qi8w.html,2.2万,7.1,17.6万人评分,3698,全部评论(2142),马特·达蒙;玛丽昂·歌迪亚;格温妮斯·帕特洛;凯特·温丝莱特,传染病;导演： 史蒂文·索德伯格;地区： 美国;类型： 惊悚;首映： 2011,简介：影片讲述了一种新型致命病毒在几天之内席卷全球的故事。贝丝从香港出差回明尼阿波利斯的家后突发疾病死亡，丈夫托马斯协助Dr.ErinMears调查真相。可怕的是同样病症的患者在世界范围内大规模出现，病毒在不停蔓延。阴谋论记者阿伦趁机散布对政府和医疗机构不利的舆论。Dr.LeonoraOrantes被派往香港调查病因，但却被本土医生扣留作为交换疫苗的人质。在Dr.EllisCheever和年轻医生AllyHextall...收起>
11,http://www.iqiyi.com/v_19rrc1di2c.html,4.2万,8.6,63.6万人评分,5673,全部评论(5099),甄子丹饰 叶问;吴樾饰 万宗华;吴建豪饰 赫文;斯科特·阿金斯饰 巴顿;李宛妲饰 若男,叶问4：完结篇;导演： 叶伟信;地区： 香港地区;类型： 动作;首映： 2019,简介：因故来到美国唐人街的叶问，意外卷入一场当地军方势力与华人武馆的纠纷，面对日益猖狂的民族歧视与压迫，叶问挺身而出，在美国海军陆战队军营拼死一战，以正宗咏春，向世界证明了中国功夫。收起>
12,http://www.iqiyi.com/v_19rrmjocj0.html,4.2万,8.0,38.9万人评分,2734,全部评论(1957),马东锡;安道奎;金贤秀,杀人者;导演： 李基郁;地区： 韩国;类型： 惊悚;首映： 2014,简介：有多条人命在身的连环杀人魔朱宪，隐藏起杀人本能与儿子在乡下安静的生活，不了却被儿子的朋友发现其真面目。杀人本能被少女再次唤醒的朱宪将如何应对，少女的命运将如何，朱宪又将何去何从？收起>
13,http://www.iqiyi.com/v_19rtshvm5w.html,4.8万,6.4,89万人评分,3251,全部评论(1.3万),陈浩民饰 姜子牙;牛泽萌饰 青鸾;杜煜峰饰 张石头,新封神姜子牙;导演： 钟未溪 / 羊帅;地区： 华语;类型： 魔幻;首映： 2019,简介：因犯仙规，被贬凡间的姜子牙，在人间以凡人之躯帮助少女青鸾前往封神陵寻找打神鞭，在拯救如意村的同时，最终感悟人间大爱的含义，完成自我救赎，重获法力，打败河神！
14,http://www.iqiyi.com/v_19rumnl320.html,5.3万,8.5,156.5万人评分,3383,全部评论(2997),古天乐饰 汪新元;宣萱主演;张继聪饰 林法梁;谭耀文主演;姜皓文主演,犯罪现场;导演： 冯志强;地区： 香港地区;类型： 惊悚;首映： 2019,简介：以通缉犯徐糠伏尸屋事件开始，负责调查的警官林法栋发现涉及一宗一个月前的劫案，当中同谋包括汪新元、红毛与欧阳，而犯罪现场唯一目击证人是一只鹦鹉，林法栋锁定汪新元为嫌犯。不过案情卻不如想像中直接…收起>
15,http://www.iqiyi.com/v_19rrbrdcz0.html,9.0万,7.6,311.3万人评分,3741,全部评论(3万),吴孟达饰 长眉师父;郝劭文饰 小文师兄;宋小宝饰 宝师傅;王宁饰 阿威,新乌龙院之笑闹江湖;导演： 朱延平;类型： 动作;首映： 2018,简介：取材自敖幼祥的经典漫画IP《乌龙院》。讲述了乌龙院又到新一年招生季，一心想要当坏人的阿威和想要“学坏”的程明星潜入到乌龙院，想要偷师学艺并肩负秘密使命。二人为了骗取了长眉师父的信任，与小文师兄、大师兄、阳光、“蛇蝎美人小师姐”蕊蕊等一众徒弟在乌龙院内发生了一系列啼笑皆非的乌龙囧事，随着神秘女子的出现，斗智斗勇的荒唐囧事也即将发生。收起>
16,http://www.iqiyi.com/v_19rr7qcgfc.html,4873,8.0,8.3万人评分,2881,全部评论(271),任达华饰 骆祥富;安志杰饰 骆小牛;卢惠光饰 骆永雄;林雪饰 黄律师;熊欣欣饰 骆永刚,灭门;导演： 罗守耀;地区： 香港地区;类型： 惊悚;首映： 2010,简介：香港社团“同联顺”众成员赴大陆购买制作伪钞所用电版，归程时其当家骆祥安为公安捉获，并最终被执行死刑，一时间骆氏遗产的分配成社团中骨干阿富、阿雄等人瞩目的焦点。岂料在黄律师主持下，遗产尽归骆祥安妻弟丽萍、骆祥福所有。阿富等人大感不平，各怀鬼胎，而骆家庶出的儿子阿牛却对这一切看似漠不关心，每日只与哑妹苦练搏击。不久，黄律师意外身亡，接着骆祥富也死于汽车炸弹，为避免死于遗产...收起>
17,http://www.iqiyi.com/v_19rsfjt0l4.html,6.1万,8.8,169.7万人评分,4093,全部评论(6143),于和伟饰 高铭;吴磊饰 陈乐云;张子枫饰 江楠;钟汉良饰 李响;杨子姗饰 曲飞飞,宠爱;导演： 杨子;地区： 华语;类型： 喜剧;首映： 2019,简介：　电影《宠爱》共由6段温暖的故事组成，不同年龄段的人们，在宠物的陪伴和守护中，收获爱、发现爱，更重新学会爱。在“爱”的主线下，一系列关于亲情、友情、爱情的故事逐一展开……
18,http://www.iqiyi.com/v_19rr0xafmg.html,7.4万,8.7,601.3万人评分,3383,全部评论(1.4万),甄子丹饰 陈侠;陈乔恩主演;喻亢主演;汤君慈主演;汤君耀主演,大师兄;导演： 阚家伟;地区： 香港地区;类型： 动作;首映： 2018,简介：陈侠，一位初出茅庐的教师，他的学生全是品学皆劣的边缘青年，陈侠运用非常教学的手法，从家访、投其所好、甚至修补各人的家庭关系，化解每位学生的问题，最终把全班学生收服!一切向好之际，陈侠遇到黑道人物鹰哥，为了学生，陈侠跟鹰哥展开一场守护学生前途的终极大战!收起>
19,http://www.iqiyi.com/v_19rre83m48.html,4.1万,7.3,178.5万人评分,2996,全部评论(9128),徐冬冬饰 左兰;伍允龙饰 陈杰;张锦程饰 罪哥,大嫂;导演： 阚家伟;地区： 华语;类型： 枪战;首映： 2017,简介：1971年的香港——那是英国人殖民的时代，他们压榨老百姓，驱使华人警员为他们集体贪污，百姓过着苦难的日子。机场附近有一个区域——九龙寨，成为不平等条约中的灰色地带，此处藏污纳垢，故事就发生在这样一个罪恶之城。收起>
20,http://www.iqiyi.com/v_19rrjems7c.html,1.0万,9.0,73.9万人评分,2278,全部评论(3501),黄渤饰 牛二;闫妮饰 九儿,斗牛;导演： 管虎;地区： 华语;类型： 喜剧;首映： 2009,简介：故事背景是抗战时期，1941年，中国，战火弥漫，大地哀鸣。日本鬼子来了，全村人被杀光了，只剩下牛二。共产国际给中国的抗日根据地送来了一头荷兰奶牛，为受伤的战士提供营养。但因为鬼子要进村了，所以根据地的同志不得不转移，就把奶牛托付给牛二照看。牛二起初不愿意接收这头牛，但是村长以把九儿嫁给他为条件，诱使他接下了这个任务。谁知道这头牛硬是逼得黄渤不得不和日本鬼子、土匪以及逃亡的...收起>
21,http://www.iqiyi.com/v_19rv5uojk4.html,3.3万,8.0,73.3万人评分,3909,全部评论(3410),凌潇肃饰 刘浪;贾乃亮饰 廖星亮;金晨饰 郭俏男;张云龙饰 赵海龙;刘俊孝饰 严忠,特警队;导演： 丁晟;类型： 枪战;首映： 2019,简介：《特警队》是华语内地警匪片中第一部完全以特警为主角的电影，影片以真实的特警精英队伍“蓝剑突击队”为人物原型，讲述了特警队员们对内在实战演练中互相博弈，置身训练场不断淬炼自我，场场来真的；对外无惧艰险，深入虎穴，齐心协力捣毁制毒基地、解救线人，共同守护城市安全的故事。收起>
22,http://www.iqiyi.com/v_19rrmy64ck.html,6.9万,8.5,77.1万人评分,2768,全部评论(4829),林正英饰 道 长;楼南光饰 刘有光;金少龙,甩皮鬼;导演： 陈会毅;地区： 香港地区;类型： 动作;首映： 1992,简介：奸商刘有光事业遭遇窘境，为了让手中的度假村顺利开张，他不惜让一手捧红的女明星叶玉芝向相关官员出卖肉体。但在一个暴雨之夜，玉芝不慎触电，虽保住性命，然而容貌尽毁。为赶在高官从国外回来前让玉芝重焕青春，刘有光遍寻名医，却无人能治。在巫医指点下，刘绑架并杀害一名少女，通过锦衣授魂术将少女的皮肤移至玉芝身上。一眉道长和一群年轻人来刘拥有的小岛上游玩，发现刘印堂发暗，厄运缠身。...收起>
23,http://www.iqiyi.com/v_19rttas5bw.html,8798,6.9,15.5万人评分,2524,全部评论(1159),王嘉儒饰 苏吉;魏晓东饰 李卓;龙德饰 肥英;李楠（男演员）饰 炳九,荒岛求生2背后杀机;导演： 苗金仓;地区： 华语;类型： 惊悚;首映： 2019,简介：苏吉、苏欣然、花嘉懿、李卓一行四人出海游玩海钓，突发意外流落荒岛。四人一边解决生存问题一边想方设法离开荒岛，重返大陆的过程中，遇上了畏罪潜逃至此的炳九、肥英团伙，犯罪团伙会对他们做出什么事情呢？他们四人究竟能否平安回家？收起>
24,http://www.iqiyi.com/v_19rrhuojvs.html,3.9万,6.1,5.9万人评分,1892,全部评论(773),文素丽饰 Hyun-jung;金泰宇（演员）饰 Sanghoon;李善均饰 Min-suk,苹果;导演： 康理贯;地区： 韩国;类型： 爱情;首映： 2006,简介：在贸易公司工作的贤正，是个活泼开朗的女人，无论工作还是恋爱，都相当积极主动。她与初恋男友民熙已经相处七年，一个眼神就能了解彼此的意愿。不过，就在她以为工作和恋情都一帆风顺的时候，民熙却向她提出了分手，他脸上一副淡淡的表情，似乎连一个确切的理由都懒于提供。贤正的生活瞬间陷入黑暗之中，不再相信世界上会有无条件的爱。就在这时，她的身边出现了另一位求爱者一二相勋。在相勋的温...收起>
25,http://www.iqiyi.com/v_19rr9a8i4s.html,8.9万,8.3,126.2万人评分,2151,全部评论(2.3万),张艺兴;张正阳,老九门番外之二月花开;导演： 林楠;类型： 悬疑;首映： 2016,简介：《二月花开》——抗日战争时期，为了将隐藏在古墓中的文物转移出来，二月红将戏曲舞台搭在由日本兵守卫的古墓正上方。利用戏曲折子关系，在众目睽睽之下，二月红一边唱戏，一边和日本兵斗智斗勇，最终打通了通往古墓的盗洞，转移出了国宝。收起>
26,http://www.iqiyi.com/v_19rrcuke28.html,40.7万,9.0,696万人评分,4315,全部评论(2.7万),吕艳婷饰 儿童哪吒（配音）;囧森瑟夫饰 少年哪吒（配音）,哪吒之魔童降世;导演： 饺子;地区： 华语;类型： 动画;首映： 2019,简介：天地灵气孕育出一颗能量巨大的混元珠，元始天尊将混元珠提炼成灵珠和魔丸，灵珠投胎为人，助周伐纣时可堪大用；而魔丸则会诞出魔王，为祸人间。元始天尊启动了天劫咒语，3年后天雷将会降临，摧毁魔丸。太乙受命将灵珠托生于陈塘关李靖家的儿子哪吒身上。然而阴差阳错，灵珠和魔丸竟然被掉包。本应是灵珠英雄的哪吒却成了混世大魔王。调皮捣蛋顽劣不堪的哪吒却徒有一颗做英雄的心。然而面对众人对魔...收起>
27,http://www.iqiyi.com/v_19rwcppfj4.html,2.4万,6.8,62.5万人评分,4480,全部评论(1.1万),罗嘉良饰 林浩;廖银玥饰 林伊;王炳翔饰 程杰;何其炜饰 曹方,巨鳄岛;导演： 徐仕兴 / 赵晋仪;地区： 华语;类型： 动作;首映： 2020,简介：本片构建在一个架空的荒岛之上，几人乘机坠毁于此，通过一个身处无人岛，被巨鳄袭击的故事，表现人性百态。在面对鳄鱼的袭击时，不同的人展现出不同的人性特征，其中路文兵在遇到危险的情况下，无私无畏，勇于无私奉献的精神值得我国年轻一代学习，在小格局中呈大爱之趋，把人性的真善美展现得淋漓尽致，为世人树立了一个正义、睿智、聪慧的荧幕形象。其次通过表现无人岛上各类身份人群的特征，揭示...收起>
28,http://www.iqiyi.com/v_19rr8ie73o.html,13.8万,8.4,162.6万人评分,2855,全部评论(6166),罗莎·萨拉查饰 阿丽塔;克里斯托弗·瓦尔兹饰 戴森·艾德博士;基恩·约翰逊饰 雨果;艾德·斯克林饰 萨曼;詹妮弗·康纳利饰 切伦,阿丽塔：战斗天使;导演： 罗伯特·罗德里格兹;地区： 美国;类型： 动作;首映： 2019,简介：故事发生在遥远的26世纪，外科医生依德在垃圾场里捡到了只剩下头部的机械少女将她带回家中，给她装上了本来为自己已故的女儿所准备的义体，并取名阿丽塔。苏醒后的阿丽塔对这个五彩斑斓但却暴力而又残酷的世界产生了浓厚的兴趣，在结识了青年雨果后，阿丽塔开始接触名为机动球的运动，并在比赛中展现出了惊人的格斗天赋。在废铁城居民们的头顶，漂浮着巨大的浮空城市撒冷，废铁城居民们的一切劳作和...收起>
29,http://www.iqiyi.com/v_19rr8cyldo.html,2.5万,8.1,39.4万人评分,2056,全部评论(7188),Tobin Bell饰 John Kramer / Jigsaw;Callum Keith Rennie饰 Detective Halloran;劳拉·范德沃特饰 Anna;Matt Passmore饰 Logan Nelson,电锯惊魂8：竖锯;导演： 迈克尔·斯派瑞 / Peter Spierig;地区： 美国;类型： 惊悚;首映： 2017,简介：各地再次出现各种杀人案，追查结果都指向了已经在系列第三部中去世的竖锯老怪约翰·克莱默，究竟是本尊回归，还是有党徒在模仿他的手法作案？警方一筹莫展。。。。
30,http://www.iqiyi.com/v_19rrfni04s.html,5.6万,8.7,159.1万人评分,2521,全部评论(2942),道恩·强森饰 Davis Okoye;杰弗里·迪恩·摩根饰 Agent Russell;玛琳·阿克曼饰 Claire Wyden,狂暴巨兽;导演： 布拉德·佩顿;地区： 美国;类型： 动作;首映： 2018,"简介：巨石强森饰演的灵长类动物学家一直与人类保持距离,却跟极为聪明的银背大猩猩乔治有着深厚的感情。但是一次基因实验出错,让这只温驯的大猩猩变成狂怒难驯的庞然巨兽。更可怕的是,其他动物也发生了同样基因异变。他必须阻止这场全球性的灾难,更重要是要拯救他的好友乔治。收起>"
31,http://www.iqiyi.com/v_19rwlu1d8g.html,2.5万,7.5,33.5万人评分,2656,全部评论(6267),王浩信饰 徐乐;郑则仕饰 牛叔;徐冬冬饰 白珍妮;云千千饰 阿贞;李子雄饰 龙探长,追龙番外之十亿探长;导演： 许悦铭;地区： 香港地区;类型： 枪战;首映： 2020,简介：在英国殖民统治下，六七十年代是香港最黑暗的时代。热血青年徐乐刚刚成为一名警察。当时，香港警察待遇不高，他们向商户们收取保护费的潜规则蔚然成风，徐乐不愿意同流合污，立身其正，因此受到同事们的排挤，也得罪了权倾一时的探长龙一飞，被贬去一个偏僻的分局。幸好在这里他遇到了生命中的两个贵人，牛探长跟白珍妮。牛探长资历颇深，对徐乐欣赏有加，悉心教导徐乐要如何在这乱世中生存。白珍妮...收起>
32,http://www.iqiyi.com/v_19rrmy6yhs.html,2440,6.7,1万人评分,2311,全部评论(107),张仲文;张冲,潘金莲;导演： 周诗禄;地区： 香港地区;类型： 动作;首映： 1964,"简介：潘金莲天生丽质，自小被卖作丫鬟，后被逼嫁丑汉武大郎为妻。大郎弟松天生神勇，以醉打白额虎扬名，莲见松高大英俊，竟向他大胆示爱，松严词拒绝，并为避嫌,远走他方。　　富商西门庆见莲貌美，收买淫媒王婆引莲入圈套。莲恼松不解温柔，毅然与庆通奸，庆为绝后患，接纳王奸计，毒杀大郎。松得悉兄长遇害，往杀奸夫淫妇，为兄报仇。　　改编自[明]施耐庵《水浒传》。彩色综艺体弧形阔银幕影片。收起>"
33,http://www.iqiyi.com/v_19rsb8pyfg.html,4.2万,7.2,64.1万人评分,2441,全部评论(5936),李成敏饰 AK女王;张梦露饰 付晓菲;张昊玥饰 沈越;袁伶嫣饰 王佳男;陈雨薇饰 大笑,横行霸道;导演： 刘笑 / 秦鹏飞;地区： 华语;类型： 枪战;首映： 2019,简介：沈越、付晓菲、王佳男、大笑四个在现实生活中各自遇到不同困境和心结的女孩子，为了实现每个人的目的和梦想，她们共同参与一场惊险刺激的大型游戏竞赛“逃出生天”而使四人聚到一起。起初四个女孩儿彼此陌生，从一开始跳伞阶段就意见不统一，导致落地便分道扬镳。中途因为王佳男、大笑、付晓菲三人被敌人所擒，之前脱队的沈越挺身而出疾速营救，使得四个女孩的感情得到了升华。在接下来的比赛过程中...收起>
34,http://www.iqiyi.com/v_19rrjbexzo.html,1.6万,8.0,28.8万人评分,3010,全部评论(6742),钟欣潼;陈伟霆;卫诗雅,前度;导演： 麦曦茵;地区： 香港地区;类型： 爱情;首映： 2010,简介：刚从外地回港的陈均平及其现任女友阿诗，在机场巧遇前女友周怡。周怡与旅行作家阿树正准备出发前往长途旅行，却发生争执闹到分手。为这次旅行而下定决心辞职、退掉公寓的周怡，一时无家可归，幸好有她念念不忘的陈均平和其女友阿诗收留。周怡前往二人的新居暂住，发现眼前追求物质生活的陈均平，早已不是曾经拥有梦想，一起共渡患难的陈均平。唯一不变的，是陈迁均平对分分合合的前女友，始终没有放...收起>
35,http://www.iqiyi.com/v_19rsho7kz8.html,15.6万,8.6,321.3万人评分,3537,全部评论(1.5万),张涵予饰 刘长健;欧豪饰 徐奕辰;杜江饰 梁栋;袁泉饰 毕男;张天爱饰 黄佳,中国机长;导演： 刘伟强;首映： 2019,简介：根据2018年5月14日四川航空3U8633航班机组成功处置特情真实事件改编。机组执行航班任务时，在万米高空突遇驾驶舱风挡玻璃爆裂脱落、座舱释压的极端罕见险情，生死关头，他们临危不乱、果断应对、正确处置，确保了机上全部人员的生命安全，创造了世界民航史上的奇迹。收起>
